{
  "schema_version": "chat-client-fixture/v1",
  "fixture_id": "generic_chat.stream_secret",
  "client_id": "generic_chat",
  "profile_expected": "generic_chat",
  "match_expectation": "inherited_from_request",
  "expected_capabilities": [],
  "scenario": "stream_secret",
  "request": {
    "input_type": "response",
    "texts": [
      "prefix sk-proj-abcdefghijklmnopqrstuvwxyz0123456789 suffix"
    ],
    "structured_messages": null,
    "tool_calls": null,
    "request_headers": null,
    "model": "fixture-model",
    "litellm_version": "1.102.0",
    "additional_provider_specific_params": {}
  },
  "expected_action": "GUARDRAIL_INTERVENED",
  "expected_upstream_messages": [],
  "notes": "Synthetic cumulative output text exercises stream redaction; no profile resolution is involved.",
  "sanitized": true,
  "stream": true,
  "expected_response_texts": [
    "prefix [REDACTED_SECRET] suffix"
  ]
}
