{
  "schema_version": "chat-client-fixture/v1",
  "fixture_id": "dsh_chat.input_secret",
  "client_id": "dsh_chat",
  "profile_expected": "generic_chat",
  "match_expectation": "fallback_required",
  "expected_capabilities": [],
  "scenario": "input_secret",
  "request": {
    "input_type": "request",
    "texts": [
      "Use this sanitized credential: sk-proj-abcdefghijklmnopqrstuvwxyz0123456789"
    ],
    "structured_messages": [
      {
        "role": "user",
        "content": "Use this sanitized credential: sk-proj-abcdefghijklmnopqrstuvwxyz0123456789"
      }
    ],
    "tool_calls": null,
    "request_headers": {
      "accept": "application/json",
      "authorization": "[present]",
      "content-type": "application/json",
      "user-agent": "sanitized-chat-client/1.0",
      "x-client-name": "[present]"
    },
    "model": "fixture-model",
    "litellm_version": "1.102.0",
    "additional_provider_specific_params": {}
  },
  "expected_action": "GUARDRAIL_INTERVENED",
  "expected_upstream_messages": [
    {
      "role": "user",
      "content": "Use this sanitized credential: [REDACTED_SECRET]"
    }
  ],
  "notes": "Synthetic credential-shaped value exercises input redaction without real credentials.",
  "sanitized": true,
  "stream": false
}
